key,0,1
#,,
int32,str,str
0,TEXT_REGNOR4CRYSTALEXARCH_00611_MYSTERYVOICE_000_000,なっ、原初世界に戻ったのでは！？
まさか、私の転移術がまた失敗……
1,TEXT_REGNOR4CRYSTALEXARCH_00611_MYSTERYVOICE_000_001,したわけではないのだな……よかった……。
2,TEXT_REGNOR4CRYSTALEXARCH_00611_MYSTERYVOICE_000_010,ああ、<Split(<Highlight>ObjectParameter(1)</Highlight>, ,1)/>。
あちらの世界での用事は済んだのか？
それとも……こっちに、新たな冒険が？
3,TEXT_REGNOR4CRYSTALEXARCH_00611_Q1_000_500,どうする？
4,TEXT_REGNOR4CRYSTALEXARCH_00611_A1_000_501,近況について聞く
5,TEXT_REGNOR4CRYSTALEXARCH_00611_A1_000_502,「マメット・グ・ラハ」を見せる
6,TEXT_REGNOR4CRYSTALEXARCH_00611_A1_000_503,「グ・ラハ・ティア」と呼んでみる
7,TEXT_REGNOR4CRYSTALEXARCH_00611_A1_000_504,キャンセル
8,TEXT_REGNOR4CRYSTALEXARCH_00611_MYSTERYVOICE_000_510,おかげさまで、ノルヴラントはあるべき姿を取り戻した。
変化にあたって多少の混乱こそあるものの、
人々は夜の闇を受け入れて、たくましく暮らしはじめたようだ。
9,TEXT_REGNOR4CRYSTALEXARCH_00611_MYSTERYVOICE_000_511,仲間の皆は、各地に散って、
変わりゆく人々に添っているようだ。
10,TEXT_REGNOR4CRYSTALEXARCH_00611_MYSTERYVOICE_000_512,アルフィノは、ユールモアへ……
アリゼーは、旅立ちの宿へ……。
そしてヤ・シュトラは、魔女として「夜の民」のもとへ。
11,TEXT_REGNOR4CRYSTALEXARCH_00611_MYSTERYVOICE_000_513,リーンたちについては、「無の大地」にて、
件の調査を進めてくれている。
12,TEXT_REGNOR4CRYSTALEXARCH_00611_MYSTERYVOICE_000_514,リーンたちについては、何やら気になることがあるとかで、
しばらくこの街に出たり入ったりしているらしい。
13,TEXT_REGNOR4CRYSTALEXARCH_00611_MYSTERYVOICE_000_515,あなたが戻ったら連絡をするように言われているが……
あの様子では、本格的に招集をかけるのは、
もう少しあとでもいいだろう。
14,TEXT_REGNOR4CRYSTALEXARCH_00611_MYSTERYVOICE_000_516,無論、その間にも、彼らを帰還させるための術について、
調べは進めておくつもりだよ。
だからあなたは、しばしの休息と、自由な旅を楽しむといい。
15,TEXT_REGNOR4CRYSTALEXARCH_00611_MYSTERYVOICE_000_520,……待て、待ってくれ。
そのマメットはいったい……何がどうしてそうなった……？
16,TEXT_REGNOR4CRYSTALEXARCH_00611_MYSTERYVOICE_000_521,タタルから渡された……？
「シルクスの峡間」の探索費用を稼ぐために作ったもので……？
さる賢人をモデルにしている……と？
17,TEXT_REGNOR4CRYSTALEXARCH_00611_MYSTERYVOICE_000_522,い、いやおかしいだろ……
私はタタルとは面識がなかったし……
誰がそんなの発案したんだ？
18,TEXT_REGNOR4CRYSTALEXARCH_00611_MYSTERYVOICE_000_523,ガラフさんとこのクルルか？
それとも……そうだ……あいつだろ、ラムブルース！
ああ、絶対に間違いない……！
19,TEXT_REGNOR4CRYSTALEXARCH_00611_MYSTERYVOICE_000_524,あいつのことだ、あわよくばそのマメットが未来に残って、
いつか目覚めた私が得も言われぬ気持ちで拾ったらおもしろい、
くらいに考えててもおかしくないぞ……！
20,TEXT_REGNOR4CRYSTALEXARCH_00611_MYSTERYVOICE_000_525,まったく……たまの冗談が冗談にならないんだよあいつ……。
まあ、「こっちはたくましく生きてるぞ」という伝言は、
これ以上ないくらいに、伝わってくるがね。
21,TEXT_REGNOR4CRYSTALEXARCH_00611_MYSTERYVOICE_000_526,そ、そうか……。
それは、その、なんというか……。
22,TEXT_REGNOR4CRYSTALEXARCH_00611_MYSTERYVOICE_000_527,……頼む、そのまま速やかに鞄にしまっておいてくれ。
どうにも、いたたまれなくなるからな……。
23,TEXT_REGNOR4CRYSTALEXARCH_00611_MYSTERYVOICE_000_530,…………！
24,TEXT_REGNOR4CRYSTALEXARCH_00611_MYSTERYVOICE_000_531,……前にも言ったが、私はこれでいて、結構な老人なのだ。
「水晶公」として生きてきた時間は長く、
それについて、無理に己を偽っているとも思っていない。
25,TEXT_REGNOR4CRYSTALEXARCH_00611_MYSTERYVOICE_000_532,ただ、それでも……
あなたがそうして昔のままに語り掛けてくると、
時折どうしようもなく、あの日の自分に返りそうになるんだ。
26,TEXT_REGNOR4CRYSTALEXARCH_00611_MYSTERYVOICE_000_533,「ノア」だった日の、あんたとオレと……
ドーガにウネ、シドたちも一緒に、
この塔にまつわる真実を求めて走り回ってた……。
27,TEXT_REGNOR4CRYSTALEXARCH_00611_MYSTERYVOICE_000_534,あのときのあんたも、すごい奴だなって思ってたけどさ……
今回は、もっとカッコよかったぞ、<Split(<Highlight>ObjectParameter(1)</Highlight>, ,1)/>！
